STATION CODE,LOCATIONS,STATE,Temp,D.O. (mg/l),PH,CONDUCTIVITY (�mhos/cm),B.O.D. (mg/l),Turbidity,Hardness,Nitrate,TOTAL COLIFORM (MPN/100ml),Mean,year
1475,ZUARI AT PANCHAWADI,NAN,29,7,430,6.4,2.4,2.96,204.8904555,NAN,175,2003
1476,"MANDOVI AT TONCA, MARCELA, GOA",NAN,29,7.2,216,7.1,1.8,4.5,129.4229205,NAN,167,2003
1400,"MANDOVI AT NEGHBOURHOOD OF PANAJI, GOA",NAN,29,7.9,352,4.5,4.2,3.06,224.2362594,NAN,158,2003
1543,"RIVER KALNA AT CHANDELNAN PERNEM, GOA",NAN,28,7,86,7.8,4.7,4.63,214.3733941,0.1,145,2003
1544,"RIVER VALVANT AT SANKLI NAN BICHOLIM, GOA",NAN,29,6.8,65,7.5,1.8,4.08,181.1015092,NAN,171,2003
1545,"RIVER MADAI AT DABOS NAN  VALPOI, GOA",NAN,28,7.1,101,7.8,2,2.56,188.3133238,0.1,138,2003
1546,"RIVER KHANDEPAR AT OPA NAN PONDA, GOA",NAN,27,7,78,7.6,1.8,2.67,248.0717353,NAN,145,2003
1547,"RIVER TALPONA AT CANACONA, GOA",NAN,29,7.2,60,8,1.9,4.4,203.3615226,NAN,151,2003
1548,"RIVER ASSONORA AT ASSONORA, GOA",NAN,28,6.6,76,7.1,1.9,3.6,118.9885791,NAN,169,2003
1150,"DAMANGANGA AT KACHIGAON U\S AT GIDC WIER,GUJARAT",NAN,28,8,368,7.4,1,3.66,227.2314692,NAN,554,2003
1246,"DAMANGANGA AT KACHIGAON D\S (DAMAN),GUJARAT",NAN,28,7.5,21331,3.6,11.7,4.01,165.5207973,NAN,14109,2003
1860,BALEHWAR KHADI AT N.H. NO. 8,NAN,30,8.1,540,7.2,2.5,3.45,218.6933005,NAN,540,2003
1861,RIVER PURNA ON BRIDGE AT SURATNANNAVSARI HIGHWAY,NAN,29,8.1,443,4,2,4.41,156.7049933,NAN,6477,2003
1862,RIVER KAVERI ON BRIDGE AT BILLIMORANANVALSAD ROAD,NAN,29,8.1,467,7.1,3,4.78,150.1749234,NAN,107,2003
1865,RIVER DHADAR AT KOTHADA,NAN,32,7.8,1304,4.6,19.5,4.38,205.3449822,NAN,63,2003
1148,"AMBIKA AT BILIMORA, GUJARAT",N,30,8,1708,7.8,3.5,4.27,186.7328807,NAN,2051,2003
1149,"KOLAK AT PATALIA BDG., GUJARAT",NAN,28,7.5,1175,5.7,4,4.5,211.0494061,NAN,3900,2003
1435,"KOLAK AT RAILWAY BRIDGE NO. 313 VAPI,VALSAD, GUJARAT",NAN,28,7.5,67115,5,5.5,2.44,273.8138067,NAN,3425,2003
1434,"AMLAKHADI AFTER CONFL. OF W. WATER FROM ANKLESH,GUJARAT",NAN,27,4,9948,0.4,513.5,2.56,279.3571668,NAN,35,2003
1436,"BHADAR D/S JETPUR VILL. AFTER CONF. OF W.WATER FROM JETPUR CITY,GUJARAT",NAN,28,7.7,1148,4.8,6.9,4.13,214.4966105,2,10050,2003
1438,"MINDHOLA AT STATE HIGHWAY BRIDGE SACHIN, GUJARAT",NAN,28,8,590,4.8,1.8,3.75,227.4350484,NAN,2873,2003
1444,"KALI AT D/S WEST COAST PAPER MILL, KARNATAKA",NAN,27,7.7,440,6.5,2.4,5.46,168.2837469,0.9,688,2003
17,"PERIYAR AT ALWAYE, KERALA",NAN,28,6.4,1579,5.8,1.7,4.53,215.9778587,0.513,959,2003
18,"PERIYAR AT KALADY, KERALA",NAN,27,6.8,62,7.5,1.5,4.82,196.9032467,0.221,892,2003
1338,"PERIYAR AT SEWAGE DISCHARGE POINT, KERALA",NAN,28,6.9,44,6.8,1,5.2,140.7390623,0.151,734,2003
20,"CHALIYAR AT KOOLIMADU, KERALA",NAN,28,6.9,62,6.8,0.4,4.18,198.7673513,0.21,802,2003
21,"CHALIYAR AT KALLAPALLY, KERALA",NAN,28,7,9416,6.7,0.5,4,207.9262602,0.241,832,2003
42,"KALLADA AT PANATHOTTUM KADAVU, PUNALOOR, KERALA",NAN,24,6.9,39,6.9,1.1,3.99,145.7681806,0.195,958,2003
43,"MUVATTAPUZHA AT VETTIKKATTUMUKKU, KERALA",NAN,28,7.1,53,6.9,1.4,6.04,266.4210181,0.367,632,2003
1154,"CHALAKUDY AT PULICKALKANANDAVU, KERALA",NAN,28,6.9,102,6.4,1.2,5.09,148.1530614,0.335,608,2003
1155,"KARMANA AT MOONNATHNANMUKKU, KERALA",NAN,27,6.8,437,5.7,1.1,2.86,209.6256005,0.922,2933,2003
1156,"PAMBA AT CHENGANNUR, KERALA",NAN,27,7.3,58,7,0.6,5.06,190.7566183,0.367,3025,2003
1341,"PAMBA AT KALLOOPARA, KERALA",NAN,26,6.9,1835,5.9,1.2,3.16,117.7912296,0.61,2400,2003
1565,"PAMBA DOWN, KERALA",NAN,27,6.8,60,5,0.9,5.03,235.0445345,0.475,3050,2003
1339,"MEENACHIL AT KIDANGOOR, KERALA",NAN,29,7.2,80,6.8,0.8,3.9,232.280452,0.252,12750,2003
1340,"MANIMALA  AT KALLOOPARA, KERALA",NAN,27,7,42,7.3,0.4,3.46,191.952743,0.347,3800,2003
1384,"MANIMALA AT THONDRA, KERALA",NAN,26,7,51,6.7,0.5,2.9,183.9087223,0.3,2900,2003
1342,"ACHENKOIL AT THUMPAMON, KERALA",NAN,26,7.1,58,6.8,0.5,2.91,304.2359121,0.337,3000,2003
1443,"ACHENKOIL AT CHENNITHULA, KERALA",NAN,26,7,63,6.4,0.6,4.32,143.4537313,0.278,3550,2003
1442,"VAMANAPURAM, KERALA",NAN,27,6.8,72,6.6,0.6,3.51,198.6143947,0.53,1350,2003
1563,"AMARAVILA, KERALA",NAN,26,6.8,83,6.5,0.9,4.43,233.8589957,0.417,1350,2003
1564,"AYUR, KERALA",NAN,24,7,69,6.4,1.2,5.18,194.8740654,0.222,1400,2003
1566,"THIRURANGADY, KERALA",NAN,28,6.8,88,6.9,0.9,4.69,238.6899285,0.307,1600,2003
1567,"KUTTIYADY ESTATE, KERALA",NAN,27,6.9,31,7,0.5,4.54,202.817483,0.164,158,2003
1568,"VALAYUM, KERALA",NAN,27,6.8,46,6.9,0.5,4.14,183.3494541,0.149,905,2003
1569,"THALIPARAMBA, KERALA",NAN,26,7.2,20850,6.5,0.9,3.2,216.8504739,0.477,1475,2003
1570,"HOSDURG, KERALA",NAN,25,7,24336,6.7,1.1,4,209.638293,0.529,620,2003
1571,"KAKKADAVU,  KERALA",NAN,25,7.1,77,7.2,0.3,4.41,173.3754984,0.411,985,2003
1572,"PADIYATHADKA, KERALA",NAN,25,7.1,76,7,0.4,3.63,129.8905723,0.167,735,2003
1573,"IRUPANAM, KERALA",NAN,29,6.5,3384,3.7,1.9,3.05,200.1914004,0.757,643,2003
1093,"ULHAS AT U/S OF NRC BUND AT MOHANE,MAHARASHTRA",NAN,26,7.7,280,6.6,5.7,2.45,168.3884308,0.994,223,2003
1094,"ULHAS AT U/S OF BADLAPUR, MAHARASHTRA",NAN,27,7.8,183,6.9,5,3.74,100.4576151,0.497,211,2003
1461,"BHATSA AT D/S OF PISE DAM NEAR PISE VILLAGE (ULHAS), MAHARASHTRA",NAN,24,7.7,107,6.8,5.2,3.79,145.0101719,0.386,208,2003
1092,"KALU AT ATALE VILLAGE, MAHARASHTRA",NAN,25,7.5,185,5.6,6.5,3.96,211.7141418,0.514,224,2003
1462,"PATALGANGA NEAR INTAKE OF MIDC W/W, MAHARASHTRA",NAN,27,7.3,157,6,5.6,4.78,181.8933656,0.603,221,2003
1151,"PATALGANGA AT SHILPHATA, MAHARASHTRA",NAN,28,7.4,150,6.3,6,3.94,260.0921726,0.614,269,2003
1152,"KUNDALIKA AT ROHA CITY, MAHARASHTRA",NAN,26,7.4,139,5.8,5.9,4.46,238.3351125,0.453,213,2003
1424,"IMPHAL AT MAHABALI, MANIPUR",NAN,21,7.3,111,7.1,2.4,4.41,190.2870501,NAN,80,2003
1457,"IMPHAL AT KOIRENGEI, MANIPUR",NAN,21,7.4,74,7.5,1.2,4.09,157.8011936,NAN,64,2003
1627,"KIYAMGI, MANIPUR",NAN,21,7.5,77,7.4,3.2,3.9,155.0557268,NAN,65,2003
1628,"MINUTHONG(IMPHAL RIVER, MANIPUR",NAN,21,7.3,97,7.3,1.9,3.92,233.402835,NAN,78,2003
1458,"IRIL AT PORAMPET, MANIPUR",NAN,21,7.4,121,7.5,2.7,3.86,213.0178297,NAN,69,2003
1624,"LILONG, MANIPUR",NAN,21,7.4,142,6.7,1.3,4.48,229.4856937,NAN,73,2003
1625,"HUMP BRIDGE, MANIPUR",NAN,23,7.3,112,8.1,17.2,4.07,195.1437388,NAN,225,2003
1626,"HEIRANGOITHONG, MANIPUR",NAN,21,7.5,124,3.7,18.5,5.22,127.7396738,NAN,247,2003
1427,"UMTREW AT BYRNIHAT EAST, MEGHALAYA",NAN,20,6.9,223,6.3,6.8,5.11,212.3066183,NAN,295,2003
1428,"KHARKHLA NEAR SUTNGA KHLIERIAT,JAINTIA HILLS DT.,MEGHALAYA",NAN,17,3.1,493,5.8,5.9,4.62,238.5693804,NAN,33,2003
1631,"MYNTDU RIVER JOWAI, MEGHALAYA",NAN,15,6.9,142,7.3,2.2,3.44,103.4647587,NAN,1573,2003
1632,"GANOL RIVER TURA, MEGHALAYA",NAN,20,6.9,145,7.8,1.8,3.64,211.200526,NAN,245,2003
1633,"SIMSANG RIVER WILLIAMNAGAR, MEGHALAYA",NAN,21,7,145,7.3,2.3,3.88,179.8897882,NAN,363,2003
1455,"RUSHIKULYA AT GANJAM U/S, ORISSA",NAN,30,8.1,569,8.2,1.6,4.16,183.08931,1.028,6050,2003
1456,"RUSHIKULYA AT GANJAM D/S, ORISSA",NAN,27,7.7,28598,7.7,1.7,5.33,116.2993299,0.962,3200,2003
1642,"NAGAVALLI AT JAYKAYPUR D/S, ORISSA",NAN,30,7.4,219,6.8,3,3.87,130.9444639,0.964,11300,2003
1643,"NAGAVALLI AT RAYAGADA D/S, ORISSA",NAN,29,7.2,198,7.2,2.1,4.66,242.2286673,1.03,4950,2003
1685,"ARASALAR RIVER KARAIKAL REGION, PONDICHERRY",NAN,29,8,978,5.4,9,5.02,219.3009142,1.24,NAN,2003
1717,"KODRA DAM, MOUNT ABU, RAJASTHAN",NAN,21,7.6,203,6.3,1.9,3.76,211.3601667,0.107,109,2003
1159,"TAMBIRAPARANI AT BDG.NR. MADURA COATS LTD.PAPAVINASAM,TAMILNADU",NAN,29,7.2,150,7.5,1.3,3.66,158.7320758,0.142,327,2003
1160,"TAMBIRAPARANI AT CHERANMADEVI,CAUSE WAY,TAMILNADU",NAN,31,7.3,178,6.7,1.5,2.29,163.6397469,0.138,190,2003
1161,"TAMBIRAPARANI AT TIRUNELVELI,COLLECTORATE,    TAMILNADU.",NAN,29,7.1,214,6.8,2.3,3.51,176.6839728,0.585,350,2003
1162,"TAMBIRAPARANI AT MURAPPANADU, TAMILNADU",NAN,NAN,7.5,293,7.2,1.2,5.01,217.522862,0.568,35,2003
1328,"TAMBIRAPARANI AT PAPPANKULAM,TAMILNADU",NAN,28,6.9,146,7.1,2,3.76,233.7643427,0.506,38,2003
1329,"TAMBIRAPARANI AT RAIL BDG. NR. AMBASAMUDAM, TAMILNADU",NAN,28,7,136,7.5,1.4,3.77,168.728583,0.609,205,2003
1330,"TAMBIRAPARANI AT ARUMUGANERI, TAMILNADU",NAN,NAN,7.9,738,7.2,2.7,2.99,204.9617498,0.518,202,2003
1450,"PALAR AT VANIYAMBADI WATER SUPPLY HEAD WORK, TAMILNADU",NAN,29,7.5,585,6.3,2.6,4.19,258.952732,0.155,315,2003
1403,"GUMTI AT U/S SOUTH TRIPURA,TRIPURA",NAN,28,7.6,98,6.2,1.2,3.61,133.8342291,NAN,570,2003
1404,"GUMTI AT D/S SOUTH TRIPURA, TRIPURA",NAN,28,7.7,91,6.5,1.3,4.92,195.4177209,NAN,562,2003
1726,"CHANDRAPUR, AGARTALA D/S OF HAORA RIVER, TRIPURA",NAN,29,7.6,110,5.7,1.1,3.39,232.0751766,NAN,546,2003
1448,"NAGAVALLI AT THOTAPALLI REGULATOR, AP",NAN,30,7.8,239,6.2,1.7,5,199.1812511,2.188,10720,2004
1399,"ZUARI AT D/S OF PT. WHERE KUMBARJRIA CANAL JOINS, GOA",NAN,29,7.5,442,6.7,3.4,2.56,300.2924758,NAN,132,2004
NAN,"NAGAVALLI AT THOTAPALLI REGULATOR, A.P.",NAN,28,5.6,7.65,375.2,1.758,4.38,206.3696824,1.995,18417,2005
NAN,"DAMANGANGA AT D/S OF MADHUBAN, DAMAN",NAN,NAN,NAN,7.76,233.3,10.825,3.36,197.9797828,5.657,NAN,2005
NAN,"DAMANGANGA  AFTER CONFL. OF PIPARIA DRAIN, DAMAN",NAN,NAN,NAN,NAN,NAN,1,3.17,199.1078856,1.01,37000,2005
NAN,"DAMANGANGA AT CIRCUIT HOUSE, SILVASA, DADRA AND NAGAR HAVELI",NAN,NAN,NAN,NAN,NAN,112,2.02,237.9199268,5.5,6400000,2005
NAN,"DAMANGANGA AT KACHIGAON U\S AT GIDC WIER,GUJARAT",NAN,26,7.2,7.84,342.8,1.764,3.65,253.2170742,0.528,230,2005
NAN,"DAMANGANGA AT KACHIGAON D\S (DAMAN),GUJARAT",NAN,27,5,7.22,18370.3,19.663,5.36,203.1465468,0.452,13525,2005
NAN,BALEHWAR KHADI AT N.H. NO. 8,NAN,29,6.2,8.11,480,11.333,4.76,197.8760897,0.39,18810,2005
NAN,RIVER PURNA ON BRIDGE AT SURATNANNAVSARI HIGHWAY,NAN,27,7.2,8.07,580,4,5.07,220.6705396,0.37,280,2005
NAN,RIVER KAVERI ON BRIDGE AT BILLIMORANANVALSAD ROAD,NAN,28,6.2,7.98,11125,5,3.71,135.8023617,0.39,50350,2005
NAN,RIVER DHADAR AT KOTHADA,NAN,28,3.9,7.92,1039,14.847,3.11,120.3276153,1.412,36,2005
NAN,"ZUARI AT D/S OF PT. WHERE KUMBARJRIA CANAL JOINS, GOA",NAN,29,7.2,7.42,246.9,4.632,3.76,163.2748283,0.791,118311,2005
NAN,ZUARI AT PANCHAWADI,NAN,28,6.9,6.44,302.9,2.304,4.88,166.8377085,0.231,116,2005
NAN,"MANDOVI AT TONCA, MARCELA, GOA",NAN,29,7.8,6.69,255.9,2.754,5.08,223.2649397,0.348,140,2005
NAN,"MANDOVI AT NEGHBOURHOOD OF PANAJI, GOA",NAN,29,6.7,7.35,346.1,1.893,4,175.6128363,0.973,148,2005
NAN,"RIVER KALNA AT CHANDELNAN PERNEM, GOA",NAN,28,8.3,6.68,348.9,2.503,4.77,169.0419175,1.686,155,2005
NAN,"RIVER VALVANT AT SANKLI NAN BICHOLIM, GOA",NAN,28,8.1,6.18,187.4,2.375,3.88,188.8041257,0.196,155,2005
NAN,"RIVER MADAI AT DABOS NAN  VALPOI, GOA",NAN,29,7.7,6.55,121.8,2.242,3.4,204.1236484,1.136,164,2005
NAN,"RIVER KHANDEPAR AT OPA NAN PONDA, GOA",NAN,29,8.6,6.56,181.4,2.423,5.53,213.5419323,0.276,155,2005
NAN,"RIVER TALPONA AT CANACONA, GOA",NAN,28,7.7,6.45,302.5,2.144,3.98,254.6175187,0.163,142,2005
NAN,"RIVER ASSONORA AT ASSONORA, GOA",NAN,28,7.4,6.07,142.8,1.681,3.96,189.995846,0.276,140,2005
NAN,"AMBIKA AT BILIMORA, GUJARAT",NAN,NAN,7,8.16,4545,4.165,5.24,185.7189888,0.343,27550,2005
NAN,"KOLAK AT PATALIA BDG., GUJARAT",NAN,NAN,5.9,7.36,761,6.1,4.24,222.6615514,0.083,4600,2005
NAN,"KOLAK AT RAILWAY BRIDGE NO. 313 VAPI,VALSAD, GUJARAT",NAN,27,4.1,7.57,29369.3,7.08,3.72,226.2847878,0.302,1993,2005
NAN,"AMLAKHADI AFTER CONFL. OF W. WATER FROM ANKLESH,GUJARAT",NAN,27,3.9,5.27,5914,441.8,2.8,252.2654912,0.512,10,2005
NAN,"BHADAR D/S JETPUR VILL. AFTER CONF. OF W.WATER FROM JETPUR CITY,GUJARAT",NAN,NAN,5.7,7.62,665,2.12,3.9,212.0289445,0.86,6000,2005
NAN,"MINDHOLA AT STATE HIGHWAY BRIDGE SACHIN, GUJARAT",NAN,NAN,6.1,8,602.5,5.64,5.63,218.424637,1.035,38428,2005
NAN,"GHAGGAR GHNAN1 AT ROAD BRDG. SIRSA,DEBWALI ROAD,HARYANA",NAN,14,6.2,7.88,540.7,9.75,4.6,190.4238985,17.387,1100,2005
NAN,"GHAGGAR GHNAN2 AT CHANDARPUR SYPHON,  HARYANA",NAN,19,6.3,8.05,634.3,13,3.43,261.8507998,10.89,75,2005
NAN,"KALI AT D/S WEST COAST PAPER MILL, KARNATAKA",NAN,27,7.1,7.2,280.5,1.6,3.15,240.4321002,0.48,95,2005
NAN,NETRAVATHI U/S OF DHARMASTALA AT WATER SUPPLY INTAKE POINT,NAN,28,7.4,7.27,253.3,1.333,6.2,122.5410399,0.17,37,2005
NAN,KUMARADHARA NAN U/S OF UPPINAGADY TOWN BEFORE CONFLUENCE WITH RIVER NETHRAVATHI,NAN,28,7.3,7.3,236.7,4,3.83,196.583886,0.08,58,2005
NAN,"PERIYAR NEAR ALWAYENANELOOR, KERALA",NAN,NAN,5.9,6.6,1359.5,1.755,4.66,136.8792139,0.326,387,2005
NAN,"PERIYAR AT KALADY, KERALA",NAN,NAN,7.4,6.68,39.3,1.164,4.2,146.9702452,0.204,298,2005
NAN,"PERIYAR AT SEWAGE DISCHARGE POINT, KERALA",NAN,NAN,7.1,6.75,41.9,1.325,2.88,230.8094825,0.18,378,2005
NAN,"CHALIYAR AT KOOLIMADU, KERALA",NAN,NAN,6.8,6.92,70.8,0.458,3.77,267.0596474,0.117,353,2005
NAN,"CHALIYAR AT CHUNGAPALLY, KERALA",NAN,NAN,6.8,6.98,7179.1,0.475,3.29,231.2487868,0.206,466,2005
NAN,"KALLADA AT PERUMTHOTTAMKADAVU, PUNALOOR, KERALA",NAN,NAN,6.8,7.03,36.8,1.117,5.05,217.2197464,0.146,624,2005
NAN,"MUVATTAPUZHA AT VETTIKKATTUMUKKU, KERALA",NAN,NAN,7.2,6.76,59.8,1.692,4.41,252.670469,0.449,357,2005
NAN,"CHALAKUDY AT PULICKALKANANDAVU, KERALA",NAN,NAN,6.2,6.63,106.8,1.275,3.81,207.7168244,0.444,360,2005
NAN,"KARAMANA AT MOONNATTUMUKKU, KERALA",NAN,NAN,6.6,6.77,250.7,1.383,3.55,228.3008604,1.54,3383,2005
NAN,"PAMBA AT CHENGANNUR, KERALA",NAN,NAN,6.9,6.95,51.3,0.625,3.81,202.2859379,0.518,3100,2005
NAN,"PAMBA AT THAKAZHY, KERALA",NAN,NAN,6,6.75,641,0.975,3.24,151.8896001,0.792,3600,2005
NAN,"PAMBA DOWN, KERALA",NAN,NAN,5.4,6.85,73.3,1.075,2.61,155.3214775,0.457,8375,2005
NAN,"MEENACHIL AT KIDANGOOR, KERALA",NAN,NAN,6.7,6.93,65,0.675,3.55,155.7404952,0.77,4200,2005
NAN,"MANIMALA  AT KALLOOPARA, KERALA",NAN,NAN,6.9,6.85,56.3,0.575,4.2,245.8951304,0.383,3400,2005
NAN,"MANIMALA AT THONDRA, KERALA",NAN,NAN,6.5,6.98,59.3,0.575,4.51,197.5019119,0.345,2600,2005
NAN,"ACHENKOIL AT THUMPAMON, KERALA",NAN,NAN,6.8,7.06,63.3,0.567,3.47,191.9087295,0.404,2825,2005
NAN,"ACHENKOIL AT CHENNITHULA, KERALA",NAN,NAN,5.8,6.73,73,0.7,3.36,160.7673113,0.315,3500,2005
NAN,"VAMANAPURAM, KERALA",NAN,NAN,6.8,6.8,69.8,0.7,3.76,177.8989666,0.61,1775,2005
NAN,"AMARAVILA, KERALA",NAN,NAN,7.1,6.83,80,0.7,4.29,202.0136426,0.835,1475,2005
NAN,"AYUR, KERALA",NAN,NAN,6.3,7.15,65.5,1.05,3.57,200.9137547,0.223,595,2005
NAN,"THIRURANGADY, KERALA",NAN,NAN,6.3,6.95,77.5,0.65,3.68,270.0227059,0.208,775,2005
NAN,"KUTTIYADY ESTATE, KERALA",NAN,NAN,6.9,6.65,34,0.5,3.03,167.3861273,0.095,215,2005
NAN,"VALAYAM, KERALA",NAN,NAN,6.4,6.75,49.3,0.675,4.16,187.0517097,0.193,350,2005
NAN,"THALIPARAMBA, KERALA",NAN,NAN,6.8,7.35,18568.3,1.15,3.42,204.2742411,0.14,660,2005
NAN,"HOSDURG, KERALA",NAN,NAN,6.8,7.08,19740.8,0.975,3.55,220.8486386,0.165,515,2005
NAN,"KAKKADAVU,  KERALA",NAN,NAN,7.1,6.98,58.3,0.55,4.42,192.9370271,0.152,510,2005
NAN,"PADIYATHADKA, KERALA",NAN,NAN,7,7.23,67.5,0.425,4.64,157.0012874,0.09,453,2005
NAN,"IRUMPANAM, KERALA",NAN,NAN,2.4,6.43,1041.3,2.025,4.92,264.2656543,1.05,373,2005
NAN,"ULHAS AT U/S OF NRC BUND AT MOHANE, MAHARASHTRA",NAN,27,6.7,7.56,128.4,4.942,3.2,152.8624335,0.447,250,2005
NAN,"ULHAS AT U/S OF BADLAPUR, MAHARASHTRA",NAN,NAN,6.8,7.68,123.2,4.475,2.93,104.752425,0.4,236,2005
NAN,"BHATSA AT D/S OF PISE DAM NEAR PISE VILLAGE (ULHAS), MAHARASHTRA",NAN,NAN,6.5,7.33,135.8,4.4,4.69,199.6529996,0.33,208,2005
NAN,"KALU AT ATALE VILLAGE, MAHARASHTRA",NAN,NAN,5.1,7.45,5168.8,9.875,4.58,155.0508931,1.81,210,2005
NAN,"PATALGANGA NEAR INTAKE OF MIDC W/W, MAHARASHTRA",NAN,NAN,6.5,7.34,128.5,5.125,4.42,197.2269809,0.819,230,2005
NAN,"PATALGANGA AT SHILPHATA, MAHARASHTRA",NAN,NAN,6.6,7.47,143.8,4.958,3.69,180.7728708,0.667,358,2005
NAN,"KUNDALIKA AT ROHA CITY, MAHARASHTRA",NAN,NAN,6.6,7.75,136.8,4.5,2.12,238.2364097,0.505,203,2005
NAN,"IMPHAL AT MAHABALI, MANIPUR",NAN,NAN,7.9,7.85,76.5,3,4.44,216.7852908,NAN,55,2005
NAN,"IMPHAL AT KOIRENGEI, MANIPUR",NAN,NAN,7.4,7,82.3,2.027,3.46,281.268667,NAN,44,2005
NAN,"KIYAMGI, MANIPUR",NAN,NAN,7,7.9,77.5,3.525,3.77,190.7794599,NAN,45,2005
NAN,"MINUTHONG(IMPHAL RIVER, MANIPUR",NAN,NAN,6.9,7.73,85.3,3.233,3.72,212.5813664,NAN,63,2005
NAN,"IRIL AT PORAMPET, MANIPUR",NAN,NAN,7.3,7.77,128.3,4.043,3.78,233.9478637,NAN,66,2005
NAN,"LILONG, MANIPUR",NAN,NAN,8,7.8,132,3.4,4.6,247.6615733,NAN,54,2005
NAN,"HUMP BRIDGE, MANIPUR",NAN,NAN,5.5,6.58,121.3,11.57,4.33,241.875105,NAN,315,2005
NAN,"HEIRANGOITHONG, MANIPUR",NAN,NAN,7,7.43,136.7,8.693,4.63,153.2211063,NAN,252,2005
NAN,"UMTREW AT BYRNIHAT EAST, MEGHALAYA",NAN,20,6.6,7.15,199,7.475,2.68,141.4924095,2.1,288,2005
NAN,"KHARKHLA NEAR SUTNGA KHLIERIAT,JAINTIA HILLS DT.,MEGHALAYA",NAN,18,6.4,3.05,605,5.067,3.7,202.2548328,4.8,45,2005
NAN,"MYNTDU RIVER JOWAI, MEGHALAYA",NAN,15,7.1,7.03,147.3,2.1,4.35,274.7049505,1,2300,2005
NAN,"GANOL RIVER TURA, MEGHALAYA",NAN,19,8.1,7.03,148.3,1.967,5.26,170.0992357,NAN,307,2005
NAN,"SIMSANG RIVER WILLIAMNAGAR, MEGHALAYA",NAN,21,8.3,7.1,152,2.133,4.1,201.5687241,NAN,413,2005
NAN,TLAWNG UPSTREAM AIZAWL,NAN,25,7.4,6.6,NAN,NAN,2.91,205.5094572,NAN,NAN,2005
NAN,TLAWNG DOWNSTREAM AIZAWL,NAN,25,6.8,6.3,NAN,NAN,3.95,127.1448918,NAN,NAN,2005
NAN,TUIRIAL UPPER CATCHMENT,NAN,25,6.1,7.15,NAN,NAN,3.31,206.1604149,NAN,NAN,2005
NAN,TUIRIAL LOWER CATCHMENT,NAN,26,7.5,7.2,NAN,NAN,3.71,233.850345,NAN,NAN,2005
NAN,"RUSHIKULYA AT GANJAM U/S, ORISSA",NAN,28,7.5,7.8,286.5,1.775,4.22,237.6773831,0.51,17625,2005
NAN,"RUSHIKULYA AT GANJAM D/S, ORISSA",NAN,30,7.5,7.35,30683,2.25,4.59,234.0699652,0.745,2145,2005
NAN,"NAGAVALLI AT JAYKAYPUR D/S, ORISSA",NAN,27,6,7.55,214.5,3.125,4.38,190.7990441,0.895,10950,2005
NAN,"NAGAVALLI AT RAYAGADA D/S, ORISSA",NAN,32,6.3,7.43,201.3,2.175,3.56,139.6857588,0.76,4500,2005
NAN,"ARASALAR RIVER KARAIKAL REGION, PONDICHERRY",NAN,29,6.1,8.33,868.5,NAN,3.67,201.1868045,1.975,NAN,2005
NAN,RIVER GHAGGAR AT D/S OF SURAJPUR,NAN,NAN,8.1,7.86,342.3,2.747,3.82,260.2053596,0.24,NAN,2005
NAN,"GHAGGAR AT MUBARAKPUR REST HOUSE (PATIALA), PUNJAB",NAN,25,7.3,7.3,157,2.067,4.62,174.1849764,0.55,348,2005
NAN,"GHAGGAR AT 100M D/S CONF. WITH R. SARASWATI (PATIALA),PUNJAB",NAN,NAN,4.9,7.33,494.7,14.533,3.66,200.2781822,2.2,18000,2005
NAN,"GHAGGAR NEAR BANKARPUR,DERA BASSI,PUNJAB",NAN,28,6.3,7.58,379.8,6.7,4.85,278.056321,1.575,4963,2005
NAN,"GHAGGAR AT RATANHERI, D/S OF PATIALA NADI (AFTER CONFL.), PUNJAB",NAN,28,6.1,7.58,490,14.25,2.88,181.8734217,2.425,27500,2005
NAN,"D/S CHHATBIR, PUNJAB",NAN,25,6.8,7.43,337.5,4.25,5.22,232.36858,1.225,3043,2005
NAN,"U/S DHAKANSU NALLAH, PUNJAB",NAN,26,6.7,7.38,333.5,3.85,4.03,168.9370725,1.575,11050,2005
NAN,"D/S DHAKANSU NALLAH, PUNJAB",NAN,27,5.9,7.48,428,8.35,2.77,141.6152867,2.2,22025,2005
NAN,"D/S JHARMAL NADI, PUNJAB",NAN,25,6.5,7.4,361.8,4.3,3.69,201.955208,1.9,15875,2005
NAN,"U/S JHARMAL NADI, PUNJAB",NAN,25,6.9,7.4,322,3.75,3.67,225.0281485,0.975,3500,2005
NAN,"GHAGGER AT MOONAK, PUNJAB",NAN,26,5.1,7.48,496.5,14.7,5.2,284.0983515,2.3,23500,2005
NAN,"D/S SARDULGARH, PUNJAB",NAN,28,5,7.4,515.3,14.76,4.19,146.5902323,2.08,37320,2005
NAN,"U/S SARDULGARH, PUNJAB",NAN,28,5.1,7.43,503.3,16.25,4.17,112.2994855,2.3,44000,2005
NAN,GHAGGAR BEFORE OTTU WEIR (BEFORE MIXING OF SATLUJ CANAL WATER) (HARYANA),NAN,16,6.2,7.63,423.3,7,3.38,176.8664829,14.013,43,2005
NAN,"GAGGAR RIVER WHEN ENTERING IN RAJASTHAN FROM HARYANA NEAR RD NO. 629, RAJASTHAN",NAN,NAN,4.4,8.23,390,1.39,4.41,261.5661726,0.08,150,2005
NAN,"GAGGAR RIVER D/S HANUMANGARH NEAR 2 KNJ NAI ABADI, MAKKASR, RAJASTHAN",NAN,NAN,4.2,8.52,380,1.26,4.21,185.692181,0.16,1100,2005
NAN,"RIVER SUKHANA AT PARWANOO, DISTT. SOLAN, H.P.",NAN,23,4,7.65,729,36,2.72,129.8238585,2.89,2950,2005
NAN,"RIVER MARKANDA AT PAONTA, DISTT. SIRMOUR, H.P.",NAN,22,8,8.31,617,4.4,2.95,248.8592673,0.655,30,2005
NAN,KALA AMB D/S MARKANDA RIVER,NAN,NAN,4.2,8.55,1184.7,341.833,3.36,216.4411715,4,NAN,2005
NAN,"KODRA DAM, MOUNT ABU, RAJASTHAN",NAN,NAN,5,7.92,160,1.443,4.73,214.1662353,0.153,149,2005
NAN,"TAMBIRAPARANI AT BDG.NR. MADURA COATS LTD.PAPAVINASAM,TAMILNADU",NAN,25,7.5,7.53,87.3,1.407,2.1,229.1921395,0.567,133,2005
NAN,"TAMBIRAPARANI AT CHERANMADEVI,CAUSE WAY,TAMILNADU",NAN,27,6.6,7.27,162.3,3.555,4.46,229.1228286,0.292,156,2005
NAN,"TAMBIRAPARANI AT TIRUNELVELI,COLLECTORATE,TAMILNADU.",NAN,28,6.8,7.12,172.3,1.723,5.43,125.4748835,0.198,283,2005
NAN,"TAMBIRAPARANI AT MURAPPANADU, TAMILNADU",NAN,NAN,6.7,7.6,277.8,1.229,4.6,230.4493293,0.183,33,2005
NAN,"TAMBIRAPARANI AT PAPPANKULAM,TAMILNADU",NAN,28,7.1,6.94,95.8,0.943,3.63,229.7713495,0.151,26,2005
NAN,"TAMBIRAPARANI AT RAIL BDG. NR. AMBASAMUDAM, TAMILNADU",NAN,27,7.4,7,88.5,0.977,3.38,183.5003784,0.186,105,2005
NAN,"TAMBIRAPARANI AT ARUMUGANERI, TAMILNADU",NAN,NAN,6.6,7.81,603.2,2.675,4.15,190.0176486,0.263,191,2005
NAN,"PALAR AT VANIYAMBADI WATER SUPPLY HEAD WORK, TAMILNADU",NAN,28,6.6,7.49,571.5,2.091,3.68,161.8963622,0.256,273,2005
NAN,"GUMTI AT U/S SOUTH TRIPURA,TRIPURA",NAN,28,5.4,7.16,75.8,2.092,4.24,163.0388346,NAN,513,2005
NAN,"GUMTI AT D/S SOUTH TRIPURA, TRIPURA",NAN,30,5.4,7.37,104.8,1.802,3.7,154.2657803,0.215,557,2005
NAN,"CHANDRAPUR, AGARTALA D/S OF HAORA RIVER, TRIPURA",NAN,29,5.3,7.37,102.2,2.552,4.18,269.809407,0.202,583,2005
1393,"DAMANGANGA AT D/S OF MADHUBAN, DAMAN",NAN,NAN,NAN,7.61,168.2,NAN,4.59,224.2663577,10.3,NAN,2006
1150,"DAMANGANGA AT KACHIGAON U\S AT GIDC WIER,GUJARAT",NAN,25,7.102,7.945,307.5,1.525,4.69,225.4819088,0.11,50,2006
1246,"DAMANGANGA AT KACHIGAON D\S (DAMAN),GUJARAT",NAN,25.5,3.487,7.015,25950,9.2,3.66,207.7254552,0.228,1400,2006
1860,BALEHWAR KHADI AT N.H. NO. 8,NAN,22,5.35,7.935,735,4.7,4.17,220.8137025,0.835,15000,2006
1861,RIVER PURNA ON BRIDGE AT SURATNANNAVSARI HIGHWAY,NAN,25.5,7.05,7.995,535,4.7,3.46,160.9683582,1.195,33500,2006
1862,RIVER KAVERI ON BRIDGE AT BILLIMORANANVALSAD ROAD,NAN,29.667,6.5,8.14,16410,5.3,2.76,186.9182451,1.397,2400,2006
1865,RIVER DHADAR AT KOTHADA,NAN,25.5,NAN,7.885,896.5,15,3.87,207.8380479,0.42,10,2006
1148,"AMBIKA AT BILIMORA, GUJARAT",NAN,29,5.6,8.173,3660,4.6,3.42,105.8592636,0.46,6867,2006
1149,"KOLAK AT PATALIA BDG., GUJARAT",NAN,26.5,6.085,7.695,933,3.2,5.3,189.1453777,0.153,1550,2006
1435,"KOLAK AT RAILWAY BRIDGE NO. 313 VAPI,VALSAD, GUJARAT",NAN,26.5,6.055,7.605,6715,4.3,3.45,213.444685,0.222,140,2006
1434,"AMLAKHADI AFTER CONFL. OF W. WATER FROM ANKLESH,GUJARAT",NAN,28,NAN,7.215,15580,431.5,4.01,276.7335689,0.395,8,2006
1436,"BHADAR D/S JETPUR VILL. AFTER CONF. OF W.WATER FROM JETPUR CITY,GUJARAT",NAN,27,7.93,8.32,2160,1.46,4.36,228.9215872,0.277,5,2006
1438,"MINDHOLA AT STATE HIGHWAY BRIDGE SACHIN, GUJARAT",NAN,25.667,4.9,7.943,504.7,3.1,3.54,192.447171,0.603,2367,2006
1399,"ZUARI AT D/S OF PT. WHERE KUMBARJRIA CANAL JOINS, GOA",NAN,27.75,6.625,7.725,149.3,2.175,2.15,141.1289215,0.123,60,2006
1475,ZUARI AT PANCHAWADI,NAN,27.75,5.175,6.95,464,1.5,4.7,137.3181658,0.7,255,2006
1476,"MANDOVI AT TONCA, MARCELA, GOA",NAN,30,6.4,7.45,142.8,2.025,4.9,238.7133934,0.155,4073,2006
1400,"MANDOVI AT NEGHBOURHOOD OF PANAJI, GOA",NAN,28.25,6.2,7.9,218,1.575,4.35,202.9907653,0.615,85,2006
1543,"RIVER KALNA AT CHANDELNAN PERNEM, GOA",NAN,26.667,7.4,6.733,344.3,1.7,4.75,273.4084481,0.9,160,2006
1544,"RIVER VALVANT AT SANKLI NAN BICHOLIM, GOA",NAN,28.75,7.6,6.775,213.3,1.3,3.89,263.7645927,0.173,3275,2006
1545,"RIVER MADAI AT DABOS NAN  VALPOI, GOA",NAN,28,7.35,7.1,214.8,1.425,3.78,112.820254,0.15,285,2006
1546,"RIVER KHANDEPAR AT OPA NAN PONDA, GOA",NAN,28.25,7.675,6.875,103.3,1.025,3.31,180.7013755,3.367,96,2006
1547,"RIVER TALPONA AT CANACONA, GOA",NAN,27.25,7.125,7.55,418.3,1.725,3.1,133.8131148,0.45,106,2006
1548,"RIVER ASSONORA AT ASSONORA, GOA",NAN,28.5,7,6.725,497.3,1.575,3.27,208.7602476,0.135,5425,2006
1093,"ULHAS AT U/S OF NRC BUND AT MOHANE, MAHARASHTRA",NAN,27.714,6.543,7.229,130.4,4.014,4.77,178.9562058,0.307,187,2006
1094,"ULHAS AT U/S OF BADLAPUR, MAHARASHTRA",NAN,28.714,6.7,7.307,121.5,3.857,2.92,183.2427962,0.264,162,2006
1461,"BHATSA AT D/S OF PISE DAM NEAR PISE VILLAGE (ULHAS), MAHARASHTRA",NAN,28.667,7.1,7.507,102.5,4.633,3.32,203.0301413,0.21,152,2006
1092,"KALU AT ATALE VILLAGE, MAHARASHTRA",NAN,26.667,6.333,7.277,542,5.4,5.19,201.0973162,7.187,207,2006
1462,"PATALGANGA NEAR INTAKE OF MIDC W/W, MAHARASHTRA",NAN,26.714,6.471,7.379,204.3,3.729,4.66,205.2140411,0.309,174,2006
1151,"PATALGANGA AT SHILPHATA, MAHARASHTRA",NAN,28.286,6.371,7.061,214,4.5,3.72,199.5860803,0.346,292,2006
1152,"KUNDALIKA AT ROHA CITY, MAHARASHTRA",NAN,19.333,6.7,7.44,153.3,4.4,3.73,177.5781419,0.65,305,2006
17,"PERIYAR NEAR ALWAYENANELOOR, KERALA",NAN,29.083,6.2,6.457,881.1,1.757,3.92,208.094004,0.326,541,2006
18,"PERIYAR AT KALADY, KERALA",NAN,27.417,7.286,6.586,82.9,1.071,4.03,252.274895,0.233,470,2006
1338,"PERIYAR AT SEWAGE DISCHARGE POINT, KERALA",NAN,27.286,6.525,6.5,124.1,1.313,4.03,265.0612161,0.227,844,2006
20,"CHALIYAR AT KOOLIMADU, KERALA",NAN,28.6,6.917,6.95,185.4,0.467,4.41,187.3150477,0.112,433,2006
21,"CHALIYAR AT CHUNGAPALLY, KERALA",NAN,28.667,6.8,7.043,8489.9,0.414,3.1,143.7884118,0.153,473,2006
42,"KALLADA AT PERUMTHOTTAMKADAVU, PUNALOOR, KERALA",NAN,27.786,7.075,7.25,107.3,0.988,4.5,216.7621587,0.369,384,2006
43,"MUVATTAPUZHA AT VETTIKKATTUMUKKU, KERALA",NAN,28.143,7.013,6.712,151.4,1.4,3.61,207.2577096,0.397,485,2006
1154,"CHALAKUDY AT PULICKALKANANDAVU, KERALA",NAN,27.5,6.787,6.65,119.3,1.637,3.44,217.369746,0.4,574,2006
1155,"KARAMANA AT MOONNATTUMUKKU, KERALA",NAN,28.571,4.1,6.775,511.4,6.788,3.7,103.173587,1.373,3100,2006
1156,"PAMBA AT CHENGANNUR, KERALA",NAN,27,6.9,6.8,224,0.733,4.2,222.2562929,0.438,2500,2006
1341,"PAMBA AT THAKAZHY, KERALA",NAN,26.5,6.867,6.833,292.7,0.633,5.16,272.9827447,0.575,2400,2006
1565,"PAMBA DOWN, KERALA",NAN,26.25,6.467,6.6,240,1.033,3.88,231.2601313,0.66,2733,2006
1339,"MEENACHIL AT KIDANGOOR, KERALA",NAN,26.75,6.667,6.933,268,0.933,3.99,145.8054024,0.893,3300,2006
1340,"MANIMALA  AT KALLOOPARA, KERALA",NAN,26.75,6.967,6.933,268,0.833,2.75,128.0966912,0.4,2233,2006
1384,"MANIMALA AT THONDRA, KERALA",NAN,26.5,6.733,6.867,324,0.933,3.85,169.974849,0.455,2233,2006
1342,"ACHENKOIL AT THUMPAMON, KERALA",NAN,27,6.714,6.957,143.4,0.671,3.94,242.0080815,0.449,2171,2006
1443,"ACHENKOIL AT CHENNITHULA, KERALA",NAN,26.75,6.733,6.733,242.7,0.9,2.44,203.4089346,0.743,2833,2006
