2298,R KUPPAM AT RAYAROM,KERALA,25,7.9,7.2,50,1.1,4.9,168.5721461,0.3,845,2012
1567,R KUTTIYADE AT KUTTIYADY ESTATE,KERALA,25,7.5,6.9,34,0.9,4.33,199.4994515,0.14,256,2012
1568,"R MAHE AT VALAYAM, KERALA",KERALA,26,7,7.4,72,1,3.17,203.2526135,0.38,897,2012
2285,R MAMOM AT MAMOM BRIDGE,KERALA,29,7.3,7.3,99,0.9,3.99,210.2612466,0.23,1788,2012
1340,MANIMALA  AT KALLOOPARA,KERALA,27,7.5,6.9,125,1.6,4.1,192.3873676,0.45,1400,2012
1384,MANIMALA AT THONDRA,KERALA,27,6.8,6.9,116,1.7,2.5,152.4800753,0.4,1260,2012
3459,"MANIYANKODE PUZHA AT MANIYANKODE BRIDGE, WAYANAD",KERALA,27,5.8,7.3,107,0.9,3.53,242.4885798,0.88,343,2012
2307,R MANJESWAR AT BAJRAKKARA BR.,KERALA,28,7.1,7.2,85,0.8,5.29,217.3680142,0.31,184,2012
1339,MEENACHIL AT KIDANGOOR,KERALA,26,6.8,7.1,58,0.7,2.63,198.5307697,0.46,3460,2012
2304,R MOGRAL AT MOGRAL BR.,KERALA,29,5.7,7.3,13197,1.5,4.63,192.5740099,0.35,144,2012
43,MUVATTAPUZHA AT VETTIKKATTUMUKKU,KERALA,27,6.7,7.1,58,1.2,5.35,229.9412343,0.39,1739,2012
2302,NEELASWARAM AT NAMBIARKAL ,KERALA,28,7,6.9,3453,0.9,4.24,157.2404584,0.17,278,2012
1570,R NEELESWARAM AT HOSDURG,KERALA,29,6.5,7,14369,1.3,3.21,178.8108276,0.27,175,2012
1563,R NEYYAR AT AMARAVILA,KERALA,28,6.6,7.3,70,1.4,3.33,173.8167101,0.39,1875,2012
2284,R NEYYAR AT ARUVIPURAM,KERALA,29,7,7.3,60,0.8,4.15,179.2182173,0.18,1813,2012
2288,R PALLICKAL AT NELLIMUKAL,KERALA,26,6.3,7.2,97,0.8,4.19,189.9421572,0.56,880,2012
1156,PAMBA AT CHENGANNUR,KERALA,28,6,7,63,1.1,4.3,187.7488492,1.04,493,2012
1341,PAMBA AT THAKAZHY,KERALA,28,4.4,7.1,113,1.5,4.44,193.9261804,1.17,722,2012
1565,PAMBA DOWN,KERALA,28,4.5,7.2,79,1,2.53,157.5133609,1.04,537,2012
17,PERIYAR NEAR ALWAYENANELOOR,KERALA,28,5.1,6.9,1789,2.1,3.98,195.7003801,0.68,1946,2012
18,PERIYAR AT KALADY,KERALA,27,7.5,7.2,36,1.1,3.24,195.7447648,0.27,1134,2012
1338,PERIYAR AT SEWAGE DISCHARGE POINT,KERALA,28,6.8,7,59,1.3,2.92,194.6351221,0.32,2267,2012
2333,PERIYAR AT MUPPATHADAM,KERALA,28,6.8,6.9,114,1.4,3.44,223.1754155,0.23,1785,2012
2334,RIVER PERIYAR AT PATHALAM,KERALA,28,5.9,6.8,1108,2.2,3.27,221.3919744,0.62,1520,2012
2335,R PERIYAR AT KALAMASSERY,KERALA,28,4.9,6.7,88,2.2,3.23,218.7927931,0.28,2200,2012
2336,R PERIYAR AT PURAPPALLIKAVU,KERALA,28,6.8,6.9,1686,1.4,5.67,225.9721356,0.25,1223,2012
3468,"PERIYAR AT KWA INTAKENAN ALUVA, ERNAKULAM",KERALA,28,7.1,6.9,45,1.2,2.73,240.8517699,0.29,1636,2012
2300,PERUVAMBA AT CHANDAPPURA,KERALA,26,6.9,6.6,56,1.1,3.2,196.7827837,0.3,542,2012
2303,R PULLUR AT PULLUR BR.,KERALA,28,6.5,6.3,49,1,3.04,174.5068195,0.22,323,2012
2290,R PUZHACKAL AT PUZHACKAL BRIDGE,KERALA,29,4.9,6.6,169,2.1,4.1,173.1539151,0.76,1241,2012
2299,R RAMAPURAM AT RAMAPURAM BRIDGE,KERALA,28,4.2,6.5,19575,1.4,4.27,203.3834632,0.39,528,2012
2305,R SHRIYA AT ANGADIMOGARU,KERALA,28,6.9,7.1,63,0.9,3.68,154.7735165,0.16,336,2012
2296,THALLASSERY AT PATHIPPALAM,KERALA,26,6.6,6.7,69,0.8,4.89,225.3504984,0.38,464,2012
2292,THIRUR AT THALAKKADATHUR BDG,KERALA,29,4.5,6.6,6381,2.1,2.97,189.814682,0.34,435,2012
2306,R UPPALA AT  UPPALA BR.,KERALA,29,6.2,7.2,9326,1.3,4.37,206.786448,0.22,141,2012
3473,"RIVER VALAPATTANAM AT PARASSINIKADAVU, KANNUR",KERALA,27,6.6,7.1,15158,1.1,4.24,184.3732318,0.26,810,2012
1442,VAMANAPURAM,KERALA,29,6.3,7.3,74,1.2,5.44,211.6620911,0.29,1813,2012
1448,NAGAVALLI AT THOTAPALLI REGULATOR,ANDHRA PRADESH,27,6,7.6,429,1.1,4.27,152.5076794,1.1,362,2012
2352,"RIVER VAMSHADHARA, KALINGAPATNAM,VIZIANAGARAM",ANDHRA PRADESH,27,6,7.8,308,1.1,4.4,182.941032,1.47,343,2012
3080,"U/S OF KARAKAVAGU AT PALONCHA,  KHAMMAM",ANDHRA PRADESH,20,5.8,7.4,505,0.6,3.06,182.3754558,0.73,1517,2012
3081,"D/S OF KARAKAVAGU AT PALONCHA,  KHAMMAM",ANDHRA PRADESH,24,6.1,7.5,465,0.5,3.66,198.8659477,0.34,1458,2012
1444,KALI AT D/S WEST COAST PAPER MILL,KARNATAKA,28,6.4,7.1,183,2.3,2.78,187.9464088,0.62,398,2012
2780,"KALI AT U/S OF WCPM, DANDELI",KARNATAKA,27,7.1,7.4,135,1.9,2.43,164.4961721,0.72,995,2012
1894,KUMARADHARA NAN U/S OF UPPINAGADY TOWN B/C WITH RIVER NETHRAVATHI,KARNATAKA,32,6.7,7.2,103,1,3.68,214.9724351, ,70,2012
1892,NETRAVATHI U/S OF DHARMASTALA AT WATER SUPPLY INTAKE POINT,KARNATAKA,30,6.8,7.1,106,1,4.89,174.7818492, ,137,2012
2423,"BUDHABALANGA, D/S OF BARIPADA",ORISSA,22,7.8,7.9,213,1.5,3.54,194.4453158,0.35,15083,2012
2424,BUDHABALANGA AT BALASORE D/S,ORISSA,22,7.7,8.1,312,2,5.51,201.3388568,0.75,32017,2012
2425,"RIVER KERANDI(INTAKE WELL OF NALCO REFINARY, HAL, SUNABEDA)",ORISSA,24,6.9,7.6,99,1.6,3.57,201.6032843,1.39,5395,2012
2422,"NAGAVALLI AT PENTA U/S, JAYKAYPUR TOWN",ORISSA,27,7.3,8,230,1.6,3.7,186.6483585,0.69,4348,2012
1642,NAGAVALLI AT JAYKAYPUR D/S,ORISSA,26,6.8,8.1,264,2.6,4.37,234.835477,1.16,5142,2012
1643,NAGAVALLI AT RAYAGADA D/S,ORISSA,25,7.2,8.1,272,3.1,3.27,171.3331234,1.46,4586,2012
1455,RUSHIKULYA AT GANJAM U/S,ORISSA,28,8,8.3,312,1.4,4.24,159.2901905,0.73,4319,2012
1456,RUSHIKULYA AT GANJAM D/S,ORISSA,29,8.2,8,19595,2,5.08,201.4101227,0.94,1116,2012
2426,VANSADHARA AT MUNIGUDA (D/S OF M/S VEDANTAALUMINA PROJECT),ORISSA,26,7,8,199,1.8,3.79,210.2697797,1.11,3573,2012
2427,VANSADHARA ATGUNUPUR (INTERSTATE BOUNDRY),ORISSA,28,7.2,8.1,201,1.6,3.62,196.5628527,0.36,2324,2012
1685,ARASALAR RIVER KARAIKAL REGION,PONDICHERRY,31,6.8,7.8,505,2.1,4.02,183.5973743,0.02, ,2012
2444,CORINGA RIVER,PONDICHERRY,25,6.5,7.9,11170,3,3,215.4291024,0.3, ,2012
2442,GAUTAMINANGODAVARI RIVER,PONDICHERRY,25,6.9,7.4,4990,3,3.44,183.2622614,0.37, ,2012
2443,GAUTAMINANGODAVARI RIVER,PONDICHERRY,25,6.8,8.1,1516, ,3.49,178.9982454,0.28, ,2012
2445,MAHE RIVER,PONDICHERRY,26,6,7.3,44600, ,3.32,172.2927625,0.23, ,2012
1450,PALAR AT VANIYAMBADI WATER SUPPLY HEAD WORK,TAMILNADU,27,6.8,7.5,890,2.1,3.3,210.2708051,0.51,589,2012
1159,TAMBIRAPARANI AT BDG.NR. MADURA COATS LTD. PAPAVINASAM,TAMILNADU,23,7.3,7.6,160,1.9,3.45,201.4332496,0.06,89,2012
1160,"TAMBIRAPARANI AT CHERANMADEVI,CAUSE WAY",TAMILNADU,25,7,7.7,111,2.2,4.27,203.0164737,0.08,131,2012
1161,"TAMBIRAPARANI AT TIRUNELVELI,COLLECTORATE",TAMILNADU,26,6.7,7.7,139,3.1,3.69,170.4453284,0.22,300,2012
1162,TAMBIRAPARANI AT MURAPPANADU,TAMILNADU,29,7.2,7.2,288,2.1,3.15,227.6543506,0.14,91,2012
1328,TAMBIRAPARANI AT PAPPANKULAM,TAMILNADU,24,7,7.1,95,1.9,2.57,173.7791592,0.08,118,2012
1329,TAMBIRAPARANI AT RAIL BDG. ,TAMILNADU,24,7,7.5,84,1.7,3.81,182.4324572,0.06,87,2012
1330,TAMBIRAPARANI AT ARUMUGANERI,TAMILNADU,29,7.4,7,3101,15.6,3.33,179.7016768,0.15,174,2012
3025,"TAMBIRAPARANI AT ERAL, THOTHUKUDI",TAMILNADU,29,7.2,7.3,510,2.9,3.47,163.4476486,0.08,123,2012
3026,"TAMBIRAPARANI AT KALLIDAI KURICHI, TIRUNELVELI",TAMILNADU,24,7.1,7.4,88,1.8,5.92,204.5693658,0.07,90,2012
3027,"TAMBIRAPARANI AT SRIVAIKUNTAM, D/S OF SK ANAICUT, TIRUNELVELI",TAMILNADU,29,7.2,6.9,338,3.8,3.28,241.6024296,0.07,104,2012
3028,"TAMBIRAPARANI AT VELLAKOIL, TIRUNELVELI",TAMILNADU,26,6.7,7.6,162,3.3,3.75,199.6381239,0.16,249,2012
3029,"TAMBIRAPARANI AT SIVALAPERI, CONFLUENCE POINT OF KUTTRALAM FALLS, D/S OF PALAYAMKOTTAI, TIRUNELVELI",TAMILNADU,27,6.7,7.6,182,4.1,4.43,228.455028,0.15,251,2012
3023,"VASISTA AT SALEM, D/S OF SAGO INDUSRIES EFFLUENT",TAMILNADU,32,0.2,7.2,2219,185.8,2.91,200.3536957,1.75,300000000,2012
1885,GHAGGAR AT D/S OF SURAJPUR,HARYANA, ,6.8,8,414,3.1,5.17,194.1666253,0.88, ,2012
1023,GHAGGAR AT MUBARAKPUR REST HOUSE (PATIALA),PUNJAB,21,5.5,7.4,635,8.8,3.43,218.3940541,5.08,5500,2012
1024,GHAGGAR AT 100M D/S CONF. WITH R. SARASWATI (PATIALA),PUNJAB,24,5.5,7.4,1051,25,3.51,190.3213908,6.8,63000,2012
1295,"GHAGGAR NEAR BANKARPUR,DERA BASSI",PUNJAB,21,5.3,7.3,636,9.9,4.15,225.7123587,5,10000,2012
1473,"GHAGGAR AT RATANHERI, D/S OF PATIALA NADI (AFTER CONFL.)",PUNJAB,24,5.1,7.4,993,21.9,4.19,210.4258745,6.63,57750,2012
1698,GHAGGAR AT D/S CHHATBIR,PUNJAB,21,5.3,7.5,632,13.5,5.6,173.840226,5.08,34750,2012
1699,GHAGGAR AT U/S DHAKANSU NALLAH,PUNJAB,18,4.9,7.4,973,17.5,5.43,203.4527154,4.77,40667,2012
1700,GHAGGAR AT D/S DHAKANSU NALLAH,PUNJAB,22,4.3,7.5,1156,24.5,4.45,211.8000845,7.65,65000,2012
1701,GHAGGAR AT D/S JHARMAL NADI,PUNJAB,22,4.8,7.4,904,26,4.64,210.9850337,8.6,55000,2012
1702,GHAGGAR AT U/S JHARMAL NADI,PUNJAB,21,5.1,7.4,1110,16,3.86,198.9104878,14.85,12000,2012
1703,GHAGGAR AT MOONAK,PUNJAB,24,5.3,7.4,1290,26.9,4.24,203.6429167,8.1,66250,2012
1704,GHAGGAR AT D/S SARDULGARH,PUNJAB,22,4.9,7.4,990,27.8,4.09,175.5856731,6.78,40500,2012
1705,GHAGGAR AT U/S SARDULGARH,PUNJAB,22,5.2,7.4,914,20.5,4.12,169.7425372,6.18,29500,2012
1025,"GHAGGAR GHNAN1 AT ROAD BRDG. SIRSA,DEBWALI ROAD",HARYANA, ,6.4,7.9,1808,21,4.43,166.5924252,5.9, ,2012
1026,GHAGGAR GHNAN2 AT CHANDARPUR ,HARYANA, ,6.6,7.8,1302,18,3.03,181.1195291, , ,2012
1887,GHAGGAR BEFORE OTTU WEIR (BEFORE MIXING OF SATLUJ CANAL ,HARYANA, ,6.4,8,1286,19.5,2.91,205.9825819, , ,2012
1718,GAGGAR RIVER WHEN ENTERING IN RAJASTHAN FROM HARYANA NEAR RD NO. 629,RAJASTHAN,33,4.8,7.5,280,2.4,2.84,184.8474873,0.72,4,2012
1871,"RIVER MARKANDA AT PAONTA, DISTT. SIRMOUR",HIMACHAL PRADESH,20,7.7,7.4,344,1.2,3.05,199.4958113,0.37,19,2012
2624,MARKANDA U/S KALA AMB,HIMACHAL PRADESH,20,7.3,7,310,1.4,3.53,189.9755527,0.38,22,2012
2625,MARKANDA D/S KALA AMB/ BOUNDARY OF HARYANA,HIMACHAL PRADESH,20,7.1,7.7,303,1.5,3.54,162.1577004,0.34,23,2012
1884,KALA AMB D/S MARKANDA RIVER,HARYANA,20,3.3,7.5,1630,185,4.84,201.0687365,1.75, ,2012
1870,"RIVER SUKHANA AT PARWANOO, DISTT. SOLAN",HIMACHAL PRADESH,18,6.2,7.5,788,41.5,3.61,198.3324402,4.08,235,2012
2947,"JAWAI AT JAWAI DAM, SIROHI",RAJASTHAN,24,6,8.3,468,1.4,4.17,191.4671103,0.43,16,2012
1717,"KODRA DAM, MOUNT ABU",RAJASTHAN,19,5.9,7.3,234,1.5,4.08,202.8869901,0.36,12,2012
2948,"BANDI AT HEMAWAS DAM, PAL",RAJASTHAN,23,6.4,8,527,1.2,4.77,180.7365263,0.35,21,2012
2949,"RIVER LUNI AT RANAKPUR DAM, RANAKPUR, PALI",RAJASTHAN,24,5.9,7.9,796,1.5,3.27,200.1622229,0.48,14,2012
3305,"BANJAR AT MALANJKHAND NR W/S INTAKE POINT, JABALPUR",MADHYA PRADESH,23,7.3,7.4,388,2.1,4.82,211.9634045,0.58,46,2012
2869,BARAK RIVER AT SENAPATI DISTT,MANIPUR,28,8.5,7.5,166,2.7,3.89,189.2614176,NAN,31,2012
2838,"BARAK RIVER NR NONEY VILL., TAMENGLONG",MANIPUR,29,8.9,7,125,1.9,3.93,205.9522501,NAN,45,2012
2868,"CHAKPIAT CHAKPIKARONG, CHANDEL",MANIPUR,30,8,7.8,144,2.1,5.44,195.3296887,NAN,51,2012
1424,IMPHAL AT MAHABALI,MANIPUR,30,7.5,7.7,87,1.2,4.24,230.5618993,NAN,54,2012
1457,IMPHAL AT KOIRENGEI,MANIPUR,28,8.5,7.6,84,2,4.71,204.8699745,NAN,16,2012
1627,IMPHAL AT KYAMGEI,MANIPUR,29,8.4,7.5,103,1.9,4.17,183.6974796,NAN,75,2012
1628,IMPHAL AT MINUTHONG,MANIPUR,30,8.7,7.2,117,3.2,3.32,203.3547884,NAN,52,2012
2861,"IMPHAL AT KANGLA MOAT, IMPHAL WEST",MANIPUR,29,6.5,7.7,287,8.2,5.25,197.666301,NAN,114,2012
2862,"IMPHAL AT SAMUROU, IMPHAL WEST",MANIPUR,28,8.6,7.5,130,4.6,4.87,213.7551769,NAN,39,2012
2864,"IMPHAL AT SEKMAI, IMPHAL EAST",MANIPUR,28,8.9,7.5,109,1.2,2.94,210.4412054,NAN,33,2012
2874,IRANG RIVER AT TAMENGLONG ,MANIPUR,30,9.8,8.4,246,1.2,3.84,199.4897165,NAN,10,2012
1458,IRIL AT PORAMPET,MANIPUR,28,7.6,7.5,147,1.3,4,180.9446965,NAN,30,2012
1624,IRIL AT LILONG,MANIPUR,29,8.7,7.6,202,1.2,4.99,208.2791813,NAN,60,2012
2863,"IRIL AT KANGLA SIPHAI, IMPHAL EAST",MANIPUR,28,8.4,7.4,177,2.4,4.81,211.9172765,NAN,48,2012
2873,"IRIL RIVER AT LILONG, UKHRUL",MANIPUR,29,8.7,7.6,203,2.5,3.58,221.0002353,NAN,59,2012
2865,"JIRI RIVER AT JIRIMUKH JIRIBAM, IMPHAL EAST",MANIPUR,32,8.2,7.4,120,1.9,3.57,200.0041212,NAN,46,2012
2866,"JIRI RIVER AT JIRI, IMPHAL EAST",MANIPUR,32,8,7.2,110,1.4,4.14,182.1005728,NAN,80,2012
1925,KHUGA RIVER (CHURACHANDPUR),MANIPUR,30,8.4,7.6,213,1.5,4.41,213.702299,NAN,20,2012
2877,"KHUGA DAM ON KHUGA R, CHURACHANDPUR",MANIPUR,29,9.4,7.8,174,1,2.96,201.0577144,NAN,16,2012
1926,"KHUJAIROK, MOREH (CHANDEL)",MANIPUR,31,8.1,8,244,2.4,4.22,158.0430653,NAN,73,2012
2878,LOKCHAO RIVER AT BISHNUPUR,MANIPUR,29,8.1,8,162,1.8,3.15,182.1295143,NAN,26,2012
2867,MAHA RIVER AT CHANDEL,MANIPUR,30,8.7,7.6,163,2.6,5.14,183.4279748,NAN,24,2012
2852,"MANIPUR AT SEKMAIJAN, THOUBAL",MANIPUR,29,8.7,7.6,143,1.9,4.17,213.9599879,NAN,58,2012
2857,MANIPUR RIVER AT THOUBAL,MANIPUR,30,9.2,7.6,208,1.9,2.99,182.0595342,NAN,30,2012
2879,ETHAI BARRAGE ON MANIPUR R AT BISHNUPUR,MANIPUR,29,8.3,7.7,158,2,2.78,197.0499653,NAN,48,2012
1625,NAMBUL RIVER AT HUMP BRIDGE,MANIPUR,29,5.9,7.1,338,6.6,3.49,182.1969054,NAN,522,2012
1626,NAMBUL AT HEIRANGOITHONG,MANIPUR,30,4.3,7.4,269,12.3,5.12,162.3596868,NAN,412,2012
2858,"NAMBUL RIVER AT SAMUSANG,IMPHAL WEST",MANIPUR,29,8.2,7.1,109,3.3,2.87,214.5293283,NAN,12,2012
2859,"SINGDA DAM AT NAMBUL, IMPHAL WEST",MANIPUR,28,11.1,7.6,131,3.6,3.97,176.319304,NAN,32,2012
2860,"NAMBUL AT NAOREMTHONG, IMPHAL WEST",MANIPUR,29,7.4,7.1,116,2.7,4.46,194.0467188,NAN,55,2012
2880,NAMBUL RIVER AT BISHNUPUR,MANIPUR,28,8.2,7.6,112,2.1,4.41,177.1743936,NAN,31,2012
1927,"SEKMAI R, KAKCHING (THOUBAL)",MANIPUR,29,8.5,7.5,169,3.6,4.13,168.6878903,NAN,41,2012
2853,"MAPITHEL DAM ON THOUBAL, THOUBAL",MANIPUR,28,11.4,7.2,128,1,2.46,199.5705251,NAN,20,2012
2854,"THOUBAL R AT PHADOM, THOUBAL",MANIPUR,29,8.9,7.6,221,1.7,2.61,217.9367989,NAN,30,2012
2856,"THOUBAL RIVER AT YAIRIPOK, THOUBAL",MANIPUR,30,9.3,7.6,193,2.3,4.35,183.789491,NAN,41,2012
2870,"THOUBAL  AT SHONG KONG, UKHRUL",MANIPUR,28,9.1,7.3,217,3.9,4.91,185.1837392,NAN,67,2012
2871,"THOUBAL  AT YONGUL KONG, UKHRUL",MANIPUR,28,7.9,7.3,131,0.8,2.98,207.5353809,NAN,38,2012
2872,"THOUBAL AT LITAN, UKHRUL",MANIPUR,29,8.7,7.4,176,2.2,3.81,196.1042977,NAN,36,2012
2855,"WANGJING AT HEIROK, THOUBAL",MANIPUR,30,8.1,7.3,199,2.2,3.24,173.1198213,NAN,56,2012
2876,"WANGJING RIVER AT WANGJING, THOUBAL",MANIPUR,30,8.2,7.4,170,2.2,4.75,213.4747064,NAN,39,2012
3383,"BUGI RIVER AT MIBANPARA, SOUTH GARO HILLS",MEGHALAYA,25,7.7,7.2,95,1.8,3.02,215.7502207,2.67,50,2012
3384,"BUGI AT DALU, SOUTH GARO HILLS",MEGHALAYA,25,7.6,7.2,92,2.5,4.02,178.7072001,2.41,45,2012
3380,"DAMRING RIVER (KRISHNEI RIVER) AT RESUBELPARA, EAST GARO HILLS",MEGHALAYA,25,9.9,7.2,65,1.5,3.16,146.1305994,2.31,55,2012
1632,GANOL RIVER TURA,MEGHALAYA,24,7.6,7.4,93,2.1,3.86,209.1570219,2.89,408,2012
1428,"KYRHUKHLA NR SUTNGA KHLIERIAT,JAINTIA HILLS ",MEGHALAYA,22,5.5,2.9,568,6.8,5.46,199.6093636,1.12,33,2012
3369,"KYNSHI RIVER AT SOHIONG, WEST KHASI HILLS",MEGHALAYA,16,7.6,7,42,1.3,4.15,181.3124182,3.01,27,2012
3370,"KYNSHI  AT NANGKHNUM, WEST KHASI HILLS",MEGHALAYA,17,7.7,7.1,45,1.4,4.26,196.1393118,2.89,22,2012
3371,"KYNSHI RIVER AT RANIKOR, WEST KHASI HILLS",MEGHALAYA,23,8.3,7,59,1.7,3.14,165.8153256,2.86,33,2012
3375,LUKHA RIVER AT MYNDIHATI (TRIBUTARY OF LUNAR),MEGHALAYA,25,6.9,2.6,1072,3.2,2.2,227.0826936,1.17,21,2012
3376,LUKHA RIVER AT SUNAPUR (TRIBUTARY OF LUNAR),MEGHALAYA,25,7.7,6.3,250,2.1,3.5,197.6848791,3.88,326,2012
3381,"MANDA RIVER (DUDHAI RIVER) AT JAMPA, EAST GARO HILLS",MEGHALAYA,25,8.8,7.3,37,1.5,5.39,195.0188878,1.62,35,2012
3382,"MANDA RIVER (DUDHAI RIVER) AT WAGAISI, EAST GARO HILLS",MEGHALAYA,25,7.3,7.3,72,2,3.13,185.3429615,1.65,36,2012
3377,"MYNTANG RIVER AT NARTIANG, JAYANTIA HILLS",MEGHALAYA,20,7.5,7,38,1.7,4.57,236.7250487,2.2,40,2012
3378,"MYNTANG RIVER AT MYNSO, JAYANTIA HILLS",MEGHALAYA,22,7.8,7.1,44,1.6,5.23,213.6103718,2.62,33,2012
1631,MYNTDU RIVER JOWAI,MEGHALAYA,20,7,7,100,2.4,3.99,241.6717998,3.03,2600,2012
3379,"MYNTDU RIVER AT LESHKA, JAYANTIA HILLS",MEGHALAYA,21,7.5,6.3,52,1.7,2.45,192.3904298,0.82,21,2012
3367,"NONBAH RIVER AT NANGSTOIN MARKE, WEST KHASI HILLS",MEGHALAYA,16,6.4,6.9,61,2.6,3.63,197.6093924,3.88,538,2012
3368,"NONBAH RIVER AT NANGSTOIN MARKE, WEST KHASI HILLS",MEGHALAYA,17,7.5,7.1,39,1.4,3.51,188.2771878,2.88,22,2012
3372,"RILANG AT MAWKYRWAT, WEST KHASI HILLS",MEGHALAYA,17,8,7.1,41,1.4,3.27,203.2966211,3.35,25,2012
1633,SIMSANG RIVER WILLIAMNAGAR,MEGHALAYA,24,7.9,7.3,93,1.7,3.65,218.4055447,5.02,418,2012
3353,"UMIAM MAWPHLANG RIVER AT NONGKREM, EAST KHASI HILLS",MEGHALAYA,18,7.5,6.9,69,1.9,4.13,192.5079836,4.92,49,2012
3354,"UMIAM MAWPHLANG RIVER AT UMTYNGNGAR, EAST KHASI HILLS",MEGHALAYA,18,7.9,7.2,46,1.7,3.48,162.2318457,2.72,45,2012
3355,"UMIAM MAWPHLANG RIVER AT MAWPHLANG, EAST KHASI HILLS",MEGHALAYA,18,8,7.2,42,1.4,3.91,184.248496,2.47,31,2012
3356,"UMIAM MAWPHLANG RIVER AT SHELLA, EAST KHASI HILLS",MEGHALAYA,25,7.7,7.1,101,1.5,3.93,220.1254226,3.42,43,2012
3350,UMKHEN AT WAHKDAIT,MEGHALAYA,19,7.2,7.1,49,1.6,3.82,203.2002856,2.86,40,2012
3351,UMKHEN AT KSEHPONGDENG,MEGHALAYA,21,8.2,7.1,49,1.2,4.44,228.8028036,2.81,32,2012
3352,"UMKHEN AT DIENGPASOH, EAST KHASI HILLS",MEGHALAYA,21,7.8,7.1,58,1.5,3.81,180.1197279,2.97,43,2012
3359,"UMKHRAH RIVER AT DEMTHRING, SHILLONG",MEGHALAYA,18,3.9,7.1,235,16.9,5.8,168.2836513,16.61,23000,2012
3360,"UMKHRAH RIVER ATUMKALIAR, SHILLONG",MEGHALAYA,18,4.9,7.1,182,14.2,4.76,196.0346231,11.61,15500,2012
3361,"UMKHRAH RIVER ATMAWLAI, SLAUGHTER",MEGHALAYA,19,2.7,7.1,281,35.4,4.71,206.8178871,14.84,62667,2012
3362,"UMKHRAH RIVER AT MAWPDANG, MAWLAI",MEGHALAYA,19,2.5,7.1,382,37.2,3.28,177.8291271,11.81,87167,2012
3357,"UMNGOT RIVER AT SMIT, EAST KHASI HILLS",MEGHALAYA,18,8,7,48,1.4,4.38,175.8906397,3.8,41,2012
3358,"UMNGOT RIVER AT DAWKI, EAST KHASI HILLS",MEGHALAYA,24,8.4,7.1,48,1.2,4.12,197.3744818,3.08,45,2012
3363,"UMSHYRPI AT RISA COLONY, EAST KHASI HILLS",MEGHALAYA,17,6.8,6.6,49,1.9,3.64,184.4348362,3.07,38,2012
3364,"UMSHYRPI  AT LAW COLLEGE, DHANKETI, EAST KHASI HILLS",MEGHALAYA,18,2.1,7,286,45.6,5.3,217.2832624,10.61,84500,2012
3365,"UMSHYRPI AT UMSHYRPI BDG, EAST KHASI HILLS",MEGHALAYA,19,4,7.1,194,22.4,4.73,159.4331752,10.47,45250,2012
1427,UMTREW AT BYRNIHAT EAST,MEGHALAYA,24,7.7,7.2,107,6.6,4.37,220.4223891,3.02,425,2012
3366,"UMTREW RIVER AT UMRAN, RINAN BHOI",MEGHALAYA,22,7.6,7.1,51,2,4.46,204.04889,2.6,81,2012
3373,"WAH BLEI AT RIANGDO, WEST KHASI HILLS",MEGHALAYA,20,7.7,7.1,46,1.6,4.36,212.5550663,3.93,22,2012
3374,"WAH BLEI AT SHDADDKHAR, WEST KHASI HILLS",MEGHALAYA,20,7.7,7.1,49,1.9,3.3,192.4360764,3.89,26,2012
2050,TLAWNG UPSTREAM AIZAWL,MIZORAM,24,6.5,7.4,297,1,4.65,200.4644449,0.13,438,2012
2051,TLAWNG DOWNSTREAM AIZAWL,MIZORAM,24,6.3,7.5,287,0.9,3.93,191.0123086,0.14,204,2012
2052,TUIRIAL UPPER CATCHMENT,MIZORAM,24,6.5,7.2,375,1.1,4.13,215.6372552,0.17,625,2012
2053,TUIRIAL LOWER CATCHMENT,MIZORAM,24,6.9,6.9,349,1.1,3.76,207.3614294,0.18,503,2012
1403,GUMTI AT U/S SOUTH TRIPURA,TRIPURA,28,6.6,7.8,165,1.6,5.25,232.3868274, ,316,2012
1404,GUMTI AT D/S SOUTH TRIPURA,TRIPURA,28,6.4,8,155,3.9,4.14,222.1130042,0.5,516,2012
1726,"CHANDRAPUR, AGARTALA D/S OF HAORA RIVER",TRIPURA,27,6.5,8,168,4.2,4.91,246.2397632,0.99,616,2012
2,"DAMANGANGA AT D/S OF MADHUBAN, DAMAN",DAMAN & DIU,NAN,NAN,0,208,NAN,3.57,150.6710211,NAN,NAN,2013
1150,"DAMANGANGA AT KACHIGAON U\S AT GIDC WIER,GUJARAT",GUJARAT,27.1,7.3,7.9,693,0.5,3.09,246.4769625,1,173,2013
1246,"DAMANGANGA AT KACHIGAON D\S (DAMAN), GUJARAT",GUJARAT,27.3,5,7.6,1676,1.8,3.04,178.2005415,8,174,2013
1865,RIVER DHADAR AT KOTHADA,GUJARAT,NAN,NAN,0,506,NAN,3.97,125.705329,6,227,2013
1434,"AMLAKHADI AFTER CONFL. OF W. WATER FROM ANKLESH,GUJARAT",GUJARAT,24.5,6,7.7,1863,8.6,3.43,200.1637946,1,1183,2013
1980,AMLAKHADI AT PUNGAM ANKLESHWAR DISTT BHARUCH,GUJARAT,NAN,NAN,NAN,24300,NAN,2.51,239.4399531,7,24,2013
1149,"KOLAK AT PATALIA BDG., GUJARAT",GUJARAT,27.5,5.3,7.8,817,2.8,3.68,306.6274814,1,23,2013
1436,"BHADAR V/S JETPUR VILL. A/C OF W. WATER FROM JETPUR CITY, GUJARAT",GUJARAT,28.3,4.3,7.8,2307,103.8,2.09,204.0414512,1.23,1817,2013
1860,BALEHWAR KHADI AT N.H. NO 8,GUJARAT,28.4,4.5,8.3,1287,1.5,4.02,195.8272127,11,5,2013
2082,TRIVENI SANGAM,GUJARAT,NAN,NAN,NAN,NAN,NAN,4.55,148.6246065,0,2,2013
1148,"AMBIKA AT BILIMORA, GUJARAT",GUJARAT,27.6,6.8,8.2,1862,2.5,4.53,194.0563929,0.87,64,2013
3205,"UPSTREAM OF RIVER VISHWAMITRI AT ASOD BRIDGE AT N.H. 8 , NEAR GLDEN CHOKDI, ASOD VEMALI ROAD",GUJARAT,NAN,5,8,NAN,0.7,3.2,162.4782263,0,NAN,2013
3204,"DOWNSTREAM OF RIVER VISHWAMITRI AT KHALIPUR VILLAGE, BEFORE MEETING JAMBUVA RIVER",GUJARAT,NAN,3,7.7,NAN,0.4,4.69,153.8097827,0,NAN,2013
1862,KAVERI ON BRIDGE AT BILLIMORANANVALSAD ROAD,GUJARAT,27,6.7,8.1,2520,7.2,3.08,219.1782966,1,41,2013
2072,RIVER BHOGAVO D/S OF SURENDRANAGAR,GUJARAT,29,8.2,8.4,606,2.9,3.36,184.7860379,0,NAN,2013
NAN,NAN,NAN,NAN,NAN,NAN,NAN,NAN,4.49,219.1433726,NAN,NAN,2013
1399,"ZUARI AT D/S OF PT. WHERE KUMBARJRIA CANAL JOINS, GOA",GOA,30,5.6,7.5,41,2,2.88,173.3909282,0.08,13410,2013
1475,ZUARI AT PANCHAWADI,GOA,30.4,5.5,6.7,209,0.8,3.39,212.8385143,0.17,2915,2013
3181,RIVER ZUARI AT BORIM BRIDGE,GOA,30.8,5.5,7.1,123,1.5,3.35,196.6037461,0.09,6264,2013
3182,RIVER ZUARI AT MARCAIM JETTY,GOA,30.3,5.3,7.3,182,1.5,3.12,271.6308238,0.08,3080,2013
1400,"MANDOVI AT NEGHBOURHOOD OF PANAJI, GOA",GOA,30.1,6,7.6,100,1.2,3.8,225.9419346,0.17,6086,2013
1476,"MANDOVI AT TONCA, MARCELA, GOA",GOA,29.9,5.7,6.9,111,1,4.43,190.2673674,0.14,3061,2013
3185,RIVER MANDOVI AT AMONA BRIDGE,GOA,29.1,6.4,7.1,140,1.1,3.71,191.6926397,0.1,7908,2013
3186,RIVER MANDOVI AT IFFI JETTY,GOA,29.9,6.2,7.8,44,2,4.01,162.2133452,0.06,9320,2013
3187,RIVER MANDOVI NEAR HOTEL MARRIOT,GOA,29.8,6.1,7.6,43,1.8,3.8,184.8285571,0.06,9554,2013
1543,"RIVER KALNA AT CHANDELNAN PERNEM, GOA",GOA,27.9,7,6.9,64,1.1,4.18,164.2545648,0.09,2841,2013
1548,"RIVER ASSONORA AT ASSONORA, GOA",GOA,28.2,6.6,6.5,62,1,3.27,161.0023053,0.14,7190,2013
2276,"RIVER BICHOLIM VARAZAN NAGAR , BICHOLIM",GOA,29.6,7,6.8,304,2,2.37,159.1689259,0.49,23867,2013
2275,"RIVER CHAPORA NEAR ALORNA FORT ,PERNEM",GOA,28.8,7,7,55,1.2,3.86,223.2788913,0.66,2813,2013
3189,RIVER CHAPORA AT SIOLIM,GOA,29.5,6.3,7.6,213,1.5,2.75,218.5493627,0.06,7069,2013
1546,"RIVER KHANDEPAR AT OPA NAN PONDA, GOA",GOA,29.8,6.7,6.8,83,1.2,2.88,140.8678983,0.17,3559,2013
2270,"RIVER KHANDEPAR AT CODLI NEAR BRIDGE ,U/S OPA WATERWORKS,SANGUEM",GOA,29.7,7.1,6.6,76,1,3.84,159.8037202,0.12,3527,2013
2272,"RIVER KUSHAWATI NEAR BUND AT KEVONA,RIVON,SANGUEM",GOA,28.7,6.7,6.6,107,1.3,3.93,157.9274924,0.22,3757,2013
1545,"RIVER MADAI AT DABOS NAN  VALPOI, GOA",GOA,27.9,7.2,6.7,89,0.9,4.1,176.6128288,0.06,1996,2013
2274,RIVER MAPUSA ON CULVERT ON HIGHWAY MAPUSANANPANAJI,GOA,29.3,4.2,6.7,192,2,3.36,225.23176,0.16,9286,2013
2271,"RIVER SAL PAZORKHONI,CUNCOLIM(NEAR CULVERT MARGAONAN CANACONA NATIONAL HIGHWAY)",GOA,28.6,6.3,6.6,79,1.6,3.59,210.7328536,0.19,6054,2013
2273,"RIVER SAL NEAR HOTEL LEELA MOBOR,CAVELOSSIM",GOA,29.8,5.6,7.7,142,1.7,3.89,214.7257042,0.14,3644,2013
3183,"RIVER SAL AT KHAREBAND, MARGAO",GOA,28.6,2.8,6.4,424,3.2,4.28,214.4695748,0.35,21036,2013
3184,"RIVER SAL AT ORLIM BRIDGE, ORLIM",GOA,30.6,5.2,7.1,306,2.6,3.87,230.9328321,0.34,1525,2013
3190,RIVER SINQUERIM (CANDOLIM SIDE NEAR BRIDGE),GOA,30.3,5.6,7.7,40,1.5,5.55,258.5268417,0.07,7130,2013
3191,RIVER SINQUERIM NEAR NERUL TEMPLE,GOA,30.4,5.5,7.7,40,1.5,3.18,210.3714356,0.08,12282,2013
1547,"RIVER TALPONA AT CANACONA, GOA",GOA,29.6,6.9,6.7,63,0.9,2.29,108.6990768,0.21,1132,2013
3188,RIVER TIRACOL AT TIRACOL,GOA,29.6,6.3,7.6,227,1.7,3.16,174.6141336,0.08,3612,2013
1544,"RIVER VALVANT AT SANKLI NAN BICHOLIM, GOA",GOA,29.5,7.1,6.6,68,1.1,4.26,143.4313503,0.13,8167,2013
2651,"AMBA RIVER AT D/S OF WAKEN BRIDGENANU/S OF JS PETROCHEMICALS, WAKENPHATA, ROHA",MAHARASHTRA,26.7,6.9,7.7,121,3.3,3.71,182.0368954,1,163,2013
1461,"BHATSA AT D/S OF PISE DAM NEAR PISE VILLAGE (ULHAS), MAHARASHTRA",MAHARASHTRA,29.3,7.2,8.2,112,3.3,3.36,184.0409883,1,94,2013
2653,"BHATSA RIVER AT D/S OF LIBERTY OIL MILLS, SATNEL, SHAHAPUR, THANE",MAHARASHTRA,28,6.9,7.7,103,3.7,2.94,194.761215,0.57,103,2013
2654,"BHATSA RIVER AT U/S OF LIBERTY OIL MILLS, SATNEL, SHAHAPUR, THANE",MAHARASHTRA,28.2,6.9,7.6,104,3.5,4.08,200.4043509,0.75,79,2013
1092,"KALU AT ATALE VILLAGE, MAHARASHTRA",MAHARASHTRA,26.5,6.4,7.4,1003,4.3,2.4,262.8084777,2.89,753,2013
2670,"KAN RIVER, NEAR SAKRI WATER WORKS, SAKRI, DHULE.",MAHARASHTRA,20.7,6.3,8.3,408,2.7,4.35,218.0623835,1.58,157,2013
1152,"KUNDALIKA AT ROHA CITY, MAHARASHTRA",MAHARASHTRA,27.2,6.7,7.8,105,3.6,4.32,202.4580608,1,89,2013
2198,KUNDALIKA RIVER AT ARE KHURD ( SALINE ZONE ),MAHARASHTRA,27.5,6.3,7.6,209,4.4,4.36,287.3702082,1.86,98,2013
2671,"KUNDALIKA RIVER NEAR SALAV BRIDGE (SALINA ZONE), SALAV, ROHA, RAIGAD",MAHARASHTRA,26,5.9,7.6,13768,5,3.34,106.3801125,1.79,300,2013
2672,"KUNDALIKA RIVER AT DHATAV AT JACKWELL (DRINKING WATER  PUMPING STATIONNANSWEET ZONE), ROHA",MAHARASHTRA,26.5,7.3,7.7,86,3.2,4.53,203.4603016,1,93,2013
2168,MITHI RIVER,MAHARASHTRA,27,3.6,7.4,6487,30.5,4.75,196.6498226,1.5,745,2013
2676,"MUCHKUNDI RIVER AT  WAKED,RATNAGIRI, NEAR M/S ASAHI INDIA GLASS LTD., LANJA, RATNAGIRI.",MAHARASHTRA,27.3,6.3,8.3,999,3.3,4.56,147.9680603,1.78,112,2013
1151,"PATALGANGA AT SHILPHATA, MAHARASHTRA",MAHARASHTRA,28.7,7.2,7.7,125,3.3,4.16,183.8400997,1,89,2013
1462,"PATALGANGA NEAR INTAKE OF MIDC W/W, MAHARASHTRA",MAHARASHTRA,28.4,7.1,7.5,127,3.4,4.53,202.2562815,4.4,63,2013
2685,"PATALGANGA RIVER AT D/S OF KHARPADA BRIDGE, RAIGAD.",MAHARASHTRA,28.7,7.1,7.4,5300,38,3.98,97.2809086,1,667,2013
2686,"PATALGANGA RIVER AT VYAL PUMP HOUSE , KHALAPUR, RAIGAD.",MAHARASHTRA,28.7,7.2,7.6,127,3.2,4.26,230.3429008,1,51,2013
2687,"PATALGANGA RIVER AT KHALAPUR PUMPING STATION, KHALAPUR, RAIGAD.",MAHARASHTRA,28.7,7,7.6,126,3.3,2.75,207.0507483,1,63,2013
2688,"PATALGANGA RIVER AT SAVROLI BRIDGE, KHALAPUR, RAIGAD.",MAHARASHTRA,28.7,7.2,7.6,126,3.4,4.3,155.5535654,1.89,64,2013
2689,"PATALGANGA RIVER AT GAGANGIRI MAHARAJ TEMPLE, KHOPOLI, RAIGAD.",MAHARASHTRA,28.7,7.1,7.8,112,3.2,4.15,168.8964217,0.63,88,2013
2199,SAVITRI RIVER AT OVALE VILLAGE.,MAHARASHTRA,29.3,6.8,7.7,9590,3.6,3.35,203.7072216,4.57,124,2013
2701,"SAVITRI RIVER JACKWELL AT UPSA KENDRE, NANGALWADI, MAHAD, RAIGAD",MAHARASHTRA,28.3,6.8,7.4,174,3.7,3.77,192.5217032,2.26,124,2013
2702,"SAVITRI RIVER AT SHEDAV DOH, MAHAD,RAIGAD",MAHARASHTRA,28.7,6.8,7.6,2572,3.3,4.93,171.751754,4.22,118,2013
2703,"SAVITRI RIVER AT DADLI BRIDGE, DADLI, MAHAD, RAIGADH",MAHARASHTRA,29.2,6.7,7.8,6030,4.4,3.74,208.3260218,4.78,138,2013
2704,"SAVITRI RIVER AT MUTHAVALI VILLAGE, MAHAD, RAIGADH",MAHARASHTRA,28.7,6.8,7.7,7207,3.9,4.53,166.9139914,4.25,120,2013
